{
  "$schema": "http://json-schema.org/draft-07/schema#",
  "$id": "https://palace-whiteroom/schemas/rotation_claim.json",
  "title": "RotationClaim",
  "description": "Produced by the Synthesizer for each per-edge rotation (Li → Li+1). A claim that the to_form re-expresses the from_form under the named justification_kind, with substantive justification.",
  "type": "object",
  "required": ["slice", "edge", "from_form", "to_form", "justification_kind", "justification"],
  "properties": {
    "slice": { "type": "string" },
    "edge":  { "enum": ["L0→L1", "L1→L2", "L2→L3", "L3→L4"] },
    "from_form": { "type": "string", "description": "The Li form being rotated from (prose or code-like)." },
    "to_form":   { "type": "string", "description": "The Li+1 form being rotated into." },
    "justification_kind": {
      "enum": ["algebraic", "structural", "reduction_chain", "empirical_match", "obstruction"]
    },
    "justification": {
      "type": "string",
      "description": "Algebraic argument / reduction-chain steps / measurement / obstruction explanation. Substantive — not hand-waving."
    },
    "push_back_proposal": {
      "type": ["object", "null"],
      "description": "Optional. If the rotation is labored, what change to a lower layer would make it natural? `null` is accepted as 'no proposal' (equivalent to omitting the field).",
      "properties": {
        "target_layer": { "enum": ["L1", "L2", "L3", "L4-calculus"] },
        "proposal": { "type": "string" }
      }
    }
  }
}
